{
  "run_id": "run-synthetic-001",
  "actor_id": "intp",
  "round": 1,
  "attempt_id": "A1",
  "action_id": "ACT1",
  "result_revision": 1,
  "input_hash": null,
  "persona_revision": "draft-1",
  "claims": [
    {
      "claim_id": "C1",
      "revision": 1,
      "actor_id": "intp",
      "kind": "hypothesis",
      "text": "合成示例待核查的假设。",
      "subject_id": "synthetic-example",
      "scope": "仅fixture",
      "assumptions": [
        "材料尚未实际读取"
      ],
      "evidence_ids": [
        "E1"
      ],
      "status": "unverified",
      "counter_claim_ids": [],
      "supersedes": null,
      "change_condition": "实际读取并验证相关路径。"
    }
  ],
  "stance_change": "initial",
  "summary": "这是协议示例，不是实际agent输出。",
  "limitations": [
    "not_run"
  ],
  "score_records": []
}
